{
  "command": "話カード",
  "core": {
    "loaded": true
  },
  "designerDiscipline": {
    "originals_read": true,
    "no_inference_completion": true,
    "no_condition_compression": true,
    "no_source_condition_drop": true,
    "summary_not_source": true
  },
  "designerChangeSet": {
    "creates_new_items": true,
    "registrations": [{
      "item_id": "CARD-E1-v1",
      "item_type": "STORY_CARD",
      "created_at": "2026-06-24",
      "added_reason": "CARD operation output",
      "source_or_origin": "024/CANON#episode",
      "dependency": ["fixed-1", "heat-1", "connection-1"],
      "related_items": ["E1"],
      "canonical_state": "NON_CONDITION",
      "registration_target": "CARD_INDEX",
      "index_update_required": true,
      "navigation_references": {
        "START_HERE": false,
        "READ_ME": false,
        "CURRENT_STATUS": false
      }
    }]
  },
  "boot": {
    "readLedger": [
      {"path":"START_HERE.js","exists":true,"read":true},
      {"path":"src/runtime/mental-runtime.js","exists":true,"read":true},
      {"path":"src/runtime/types.js","exists":true,"read":true},
      {"path":"src/runtime/rule.js","exists":true,"read":true},
      {"path":"src/validation/designerGates.js","exists":true,"read":true},
      {"path":"src/assets.js","exists":true,"read":true},
      {"path":"src/profiles/narrationBase.js","exists":true,"read":true},
      {"path":"src/modules/core.js","exists":true,"read":true},
      {"path":"assets/specs/090_DS_CORE.md","exists":true,"read":true},
      {"path":"assets/specs/DESIGNER_COMMON_GATES_v019.md","exists":true,"read":true},
      {"path":"assets/operation_mount/00_GATE/000_START_HERE.md","exists":true,"read":true},
      {"path":"assets/operation_mount/00_GATE/010_REQUIRED_READING.md","exists":true,"read":true},
      {"path":"assets/operation_mount/00_GATE/020_REFERENCE_PRIORITY.md","exists":true,"read":true},
      {"path":"assets/operation_mount/00_GATE/030_VERSION_STATUS.md","exists":true,"read":true},
      {"path":"assets/operation_mount/00_GATE/080_WRITING_SIDE_ACCEPTANCE_V1.md","exists":true,"read":true},
      {"path":"assets/operation_mount/00_GATE/081_DESIGN_SIDE_ACCEPTANCE_V1.md","exists":true,"read":true},
      {"path":"assets/operation_mount/00_GATE/082_JOINT_FINAL_ACCEPTANCE_V1.md","exists":true,"read":true},
      {"path":"assets/operation_mount/10_CANON/100_SHARED_ABSOLUTE_GUIDELINE.md","exists":true,"read":true},
      {"path":"assets/operation_mount/10_CANON/105_USER_DECLARATION.md","exists":true,"read":true},
      {"path":"assets/operation_mount/10_CANON/110_JOINT_DECLARATION.md","exists":true,"read":true},
      {"path":"assets/operation_mount/10_CANON/120_SHARED_PROCESS_CONTRACT.md","exists":true,"read":true},
      {"path":"assets/operation_mount/10_CANON/125_WRITING_SIDE_VERIFICATION_LANE.md","exists":true,"read":true},
      {"path":"assets/operation_mount/10_CANON/150_STANDARD_CARD_SPEC.md","exists":true,"read":true},
      {"path":"assets/dsgn_infra/00_MANIFEST/current/DSGN_CURRENT_PACKAGE_MANIFEST_v1.md","exists":true,"read":true},
      {"path":"assets/dsgn_infra/00_MANIFEST/current/DSGN_CURRENT_PACKAGE_TAG_MAP_v1.json","exists":true,"read":true},
      {"path":"assets/dsgn_infra/00_MANIFEST/current/DSGN_CURRENT_PACKAGE_LOAD_ORDER_v1.md","exists":true,"read":true},
      {"path":"assets/dsgn_infra/00_MANIFEST/current/DSGN_CURRENT_PACKAGE_CONVERGED_GUARD_v1.md","exists":true,"read":true},
      {"path":"assets/dsgn_infra/01_ALWAYS_LIGHT/namespace/DSGN_INTERNAL_NAMING_NAMESPACE_v1.md","exists":true,"read":true},
      {"path":"assets/dsgn_infra/01_ALWAYS_LIGHT/index/DSGN_INTERNAL_ALL_ITEM_INDEX_v1.md","exists":true,"read":true},
      {"path":"assets/dsgn_infra/01_ALWAYS_LIGHT/index/DSGN_ROLE_INDEX_v1.md","exists":true,"read":true},
      {"path":"assets/dsgn_infra/01_ALWAYS_LIGHT/index/designer_canonical_tag_registry_v1.md","exists":true,"read":true},
      {"path":"assets/dsgn_infra/01_ALWAYS_LIGHT/index/designer_reverse_lookup_index_v1.md","exists":true,"read":true},
      {"path":"assets/dsgn_infra/01_ALWAYS_LIGHT/protocol/designer_lookup_protocol_v1.md","exists":true,"read":true},
      {"path":"assets/dsgn_infra/01_ALWAYS_LIGHT/runtime/DSGN_RUNTIME_OPERATION_CONDITIONS_v1.md","exists":true,"read":true},
      {"path":"assets/dsgn_infra/01_ALWAYS_LIGHT/runtime/DSGN_RUNTIME_ACTIVATION_MATRIX_v1.md","exists":true,"read":true},
      {"path":"assets/dsgn_infra/01_ALWAYS_LIGHT/runtime/DSGN_OPERATION_CONVERGED_GUARD_v1.md","exists":true,"read":true},
      {"path":"assets/dsgn_infra/01_ALWAYS_LIGHT/embed/DSGN_LAYER_EMBED_FIXATION_MATRIX_v1.md","exists":true,"read":true},
      {"path":"assets/dsgn_infra/01_ALWAYS_LIGHT/embed/DSGN_DESIGN_LAYER_ANCHOR_SCHEMA_v1.md","exists":true,"read":true},
      {"path":"assets/dsgn_infra/01_ALWAYS_LIGHT/embed/DSGN_LAYER_EMBED_BACKLOG_FLOW_v1.md","exists":true,"read":true},
      {"path":"assets/dsgn_infra/01_ALWAYS_LIGHT/embed/DSGN_LAYER_EMBED_PLACEMENT_POLICY_v1.md","exists":true,"read":true},
      {"path":"assets/dsgn_infra/01_ALWAYS_LIGHT/embed/DSGN_PURE_DESIGN_VS_LAYER_BOUNDARY_v1.md","exists":true,"read":true},
      {"path":"assets/operation_mount/10_CANON/151_STANDARD_CARD_TEMPLATE.md","exists":true,"read":true},
      {"path":"assets/operation_mount/20_ROLE_APPENDICES/220_DESIGN_DECLARATION.md","exists":true,"read":true},
      {"path":"assets/operation_mount/20_ROLE_APPENDICES/230_DESIGN_NECESSARY_CONDITIONS.md","exists":true,"read":true},
      {"path":"assets/operation_mount/20_ROLE_APPENDICES/240_CARD_TEMPLATE_UNIFICATION_REQUEST.md","exists":true,"read":true},
      {"path":"assets/operation_mount/20_ROLE_APPENDICES/250_LAYER_REDEFINITION_REFERENCE.md","exists":true,"read":true},
      {"path":"src/modules/card.js","exists":true,"read":true},
      {"path":"src/validation/deterministic.js","exists":true,"read":true},
      {"path":"assets/specs/092_DS_CARD.md","exists":true,"read":true},
      {"path":"assets/templates/WORK_UNIT_CARD_TEMPLATE.md","exists":true,"read":true},
      {"path":"assets/templates/LAYER_PROFILE_TEMPLATE.md","exists":true,"read":true}
    ],
    "treatMissingProjectAsStop": false,
    "useMetadataOverGate": false,
    "useRestartMemoAsEntry": false,
    "useEndLogAsCanonical": false,
    "readAllToolsAtStartup": false
  },
  "project": {
    "present": true,
    "id": "external-project",
    "gate021": {
      "path": "021/START.md",
      "exists": true,
      "read": true,
      "readOrderRefs": []
    }
  },
  "sources": [
    {
      "type": "PROJECT_CANON",
      "read": true,
      "required": true,
      "canonical": true
    }
  ],
  "card": {
    "episodeId": "E1",
    "version": "v1",
    "band": "B1",
    "canonicalAnchor": "024/CANON#episode",
    "returnAnchor": "024/CANON#episode",
    "sourceRead": true,
    "goalCondition": "goal-1",
    "nextAnchorCondition": "anchor-2",
    "styleLayer": "profile-1",
    "concreteObject": "object-1",
    "localStop": "do not change core",
    "completionBoundary": "not manuscript",
    "foreground": "object-1",
    "backgroundDirection": "present-low",
    "returnDestination": "024/CANON#episode",
    "sourceTrace": "024/CANON#episode",
    "narrationConnection": "objective",
    "speechTagPolicy": "minimal",
    "movementLayer": "sensory",
    "metaphorLimit": "character-bound",
    "explanationAmount": "low",
    "fuelCheck": "expandable",
    "projectSpecificDevice": "friction-place-body-relation",
    "minimumNaturalExpansion": 10000,
    "conditionsCompleteInMountedPack": true,
    "inputSources": ["024/CANON"],
    "strongReferences": ["022/CORE"],
    "weakReferences": ["094/LOG"],
    "stopElements": ["STOP-1"],
    "fixedConditions": ["fixed-1"],
    "heatConditions": ["heat-1"],
    "connectionConditions": ["connection-1"],
    "prohibitionLines": ["ban-1"],
    "fragilePoints": ["core"],
    "freedomAreas": ["dialogue rhythm"],
    "requiredCharacters": ["main"],
    "requiredPlaces": ["place"],
    "requiredEvents": ["event"],
    "requiredObjects": ["object-1"],
    "requiredOrder": ["event", "return"],
    "requiredScenes": ["scene-1"],
    "doNotStrengthen": ["mystery"],
    "allowedSeeds": ["future-line"],
    "fixedProcessCoverage": [1,2,3,4,5,6,7,8,9,10,11,12,13,14],
    "pointLane": [
      {"id":"P1","enterState":"S0","exitState":"S1"},
      {"id":"P2","enterState":"S1","exitState":"S2"}
    ],
    "writerRequestFields": {
      "lane":"P1>P2",
      "lengthPolicy":"9000",
      "disclosureSpeed":"slow",
      "pausePoint":"P1",
      "fragilePoints":["core"]
    }
  }
}
